string_id,instrument_id,row,course_role,target_note,target_frequency_hz,starting_speaking_length_mm,string_material_candidate,string_gauge_candidate,unit_weight_kg_per_m,unit_weight_source,calculated_tension_newtons,calculated_tension_lbf,supplier_limit_newtons,safety_factor,frame_load_component_newtons,evidence_source,status,notes
S01,KGH-MULE-01,single,mule,G3,196.00,620,nylon or fluorocarbon,0.030-0.034 in,,vendor_required,,,,,,string-schedule.csv,blocked_waiting_for_unit_weight,Do not tension from this row until vendor or measured unit weight is entered.
S02,KGH-MULE-01,single,mule,A3,220.00,590,nylon or fluorocarbon,0.028-0.032 in,,vendor_required,,,,,,string-schedule.csv,blocked_waiting_for_unit_weight,Use supplier limit and knot/anchor derating before tuning.
S03,KGH-MULE-01,single,mule,C4,261.63,550,nylon or fluorocarbon,0.026-0.030 in,,vendor_required,,,,,,string-schedule.csv,blocked_waiting_for_unit_weight,Representative mid-register load row for first calculation pass.
S04,KGH-MULE-01,single,mule,D4,293.66,520,nylon or fluorocarbon,0.024-0.028 in,,vendor_required,,,,,,string-schedule.csv,blocked_waiting_for_unit_weight,Track pin slip and bridge contact during staged proof load.
S05,KGH-MULE-01,single,mule,E4,329.63,490,nylon or fluorocarbon,0.022-0.026 in,,vendor_required,,,,,,string-schedule.csv,blocked_waiting_for_unit_weight,Replace gauge range with selected supplier SKU before purchase.
S06,KGH-MULE-01,single,mule,G4,392.00,450,nylon or fluorocarbon,0.020-0.024 in,,vendor_required,,,,,,string-schedule.csv,blocked_waiting_for_unit_weight,High-side mule string for bridge clearance and anchor review.
TOTAL,KGH-MULE-01,single,mule,total,,,,,,,,,,,,tension-study.csv,blocked_waiting_for_rows,Sum only after every loaded string has calculated tension and frame-load component.
